{"authored":[{"firstSigner":false,"id":6005,"number":5,"presentedAt":"2023-03-14","sourceUrl":"https://www.camara.leg.br/propostas-legislativas/6005","status":"Aguardando Parecer","summary":"Ementa 6005","type":"PRC","year":2023},{"firstSigner":false,"id":6004,"number":4,"presentedAt":"2023-03-13","sourceUrl":"https://www.camara.leg.br/propostas-legislativas/6004","status":"Aguardando Parecer","summary":"Ementa 6004","type":"PDL","year":2023},{"firstSigner":true,"id":6003,"number":3,"presentedAt":"2023-03-12","sourceUrl":"https://www.camara.leg.br/propostas-legislativas/6003","status":"Aguardando Parecer","summary":"Ementa 6003","type":"PEC","year":2023},{"firstSigner":false,"id":6002,"number":2,"presentedAt":"2023-03-11","sourceUrl":"https://www.camara.leg.br/propostas-legislativas/6002","status":"Aguardando Parecer","summary":"Ementa 6002","type":"PLP","year":2023},{"firstSigner":true,"id":6001,"number":1,"presentedAt":"2023-03-10","sourceUrl":"https://www.camara.leg.br/propostas-legislativas/6001","status":"Aguardando Parecer","summary":"Ementa 6001","type":"PL","year":2023}],"authoredCount":5,"candidacy2026":{"ballotNumber":"1313","office":"DEPUTADO FEDERAL","party":"PT","situation":"APTO"},"exercisePeriods":[{"end":"2026-09-27T09:00:00","start":"2023-02-01T12:05:00"}],"firstSignerCount":2,"governmentAlignment":{"count":2,"total":3},"id":101,"inExercise":true,"name":"Ana Souza","participation":{"count":4,"total":5},"party":"PT","partyAlignment":{"count":2,"total":3},"photoUrl":"https://www.camara.leg.br/internet/deputado/bandep/101.jpg","requirementsCount":3,"sourceUrl":"https://www.camara.leg.br/deputados/101","uf":"SP","votes":[{"party":"PT","partyMajority":null,"rollCallId":"100-6","vote":""},{"party":"PT","partyMajority":null,"rollCallId":"100-4","vote":"Obstrução"},{"party":"PT","partyMajority":null,"rollCallId":"200-3","vote":"Não"},{"party":"PT","partyMajority":null,"rollCallId":"100-3","vote":""},{"party":"PT","partyMajority":null,"rollCallId":"100-2","vote":"Não"},{"party":"PT","partyMajority":"Não","rollCallId":"200-2","vote":"Abstenção"},{"party":"PT","partyMajority":"Sim","rollCallId":"200-1","vote":"Sim"},{"party":"PT","partyMajority":"Sim","rollCallId":"100-1","vote":"Sim"}]}
