{"authored":[],"authoredCount":0,"candidacy2026":null,"exercisePeriods":[],"firstSignerCount":0,"governmentAlignment":{"count":0,"total":1},"id":103,"inExercise":false,"name":"Carla Dias","participation":{"count":0,"total":0},"party":"NOVO","partyAlignment":{"count":0,"total":0},"photoUrl":"https://www.camara.leg.br/internet/deputado/bandep/103.jpg","requirementsCount":0,"sourceUrl":"https://www.camara.leg.br/deputados/103","uf":"MG","votes":[{"party":"NOVO","partyMajority":null,"rollCallId":"100-1","vote":"Não"}]}
