{"authored":[{"firstSigner":false,"id":6001,"number":1,"presentedAt":"2023-03-10","sourceUrl":"https://www.camara.leg.br/propostas-legislativas/6001","status":"Aguardando Parecer","summary":"Ementa 6001","type":"PL","year":2023}],"authoredCount":1,"candidacy2026":{"ballotNumber":"131","office":"SENADOR","party":"PT","situation":"APTO"},"exercisePeriods":[{"end":"2024-03-01T00:00:00","start":"2023-02-01T12:05:00"},{"end":"2026-09-27T09:00:00","start":"2025-01-10T10:00:00"}],"firstSignerCount":0,"governmentAlignment":{"count":1,"total":1},"id":102,"inExercise":true,"name":"Bruno Lima","participation":{"count":3,"total":3},"party":"PT","partyAlignment":{"count":2,"total":3},"photoUrl":"https://www.camara.leg.br/internet/deputado/bandep/102.jpg","requirementsCount":0,"sourceUrl":"https://www.camara.leg.br/deputados/102","uf":"RJ","votes":[{"party":"PT","partyMajority":null,"rollCallId":"100-6","vote":""},{"party":"PT","partyMajority":"Obstrução","rollCallId":"100-4","vote":"Artigo 17"},{"party":"PT","partyMajority":"Abstenção","rollCallId":"200-2","vote":"Não"},{"party":"PT","partyMajority":"Sim","rollCallId":"200-1","vote":"Sim"},{"party":"PT","partyMajority":"Sim","rollCallId":"100-1","vote":"Sim"}]}
